title,content,title_tokens,content_tokens
Waycarbon lanca nova ferramenta para monitorar evolucao de empresas ate o net zero,A Waycarbon empresa de solucoes para o mercado de carbono lanca nesta quinta feira 17 data em que comemora 17 anos uma nova ferramenta que tem o objetivo de quase desenhar para as empresas o qu 4938 chars,"['Waycarbon', 'lanca', 'nova', 'ferramenta', 'para', 'monitorar', 'evolucao', 'de', 'empresas', 'ate', 'o', 'net', 'zero']","['A', 'Waycarbon', 'empresa', 'de', 'solucoes', 'para', 'o', 'mercado', 'de', 'carbono', 'lanca', 'nesta', 'quinta', 'feira', '17', 'data', 'em', 'que', 'comemora', '17', 'anos', 'uma', 'nova', 'ferramenta', 'que', 'tem', 'o', 'objetivo', 'de', 'quase', 'desenhar', 'para', 'as', 'empresas', 'o', 'qu', '4938', 'chars']"
O que esta acontecendo na Libia Inundacao deixa mais de 5 mil mortos,Fortes chuvas no nordeste da Libia provocadas pela Tempestade Daniel causaram o colapso de duas barragens no domingo 10 inundando cidades na regiao especialmente Derna Ao menos tres pontes for 5524 chars,"['O', 'que', 'esta', 'acontecendo', 'na', 'Libia', 'Inundacao', 'deixa', 'mais', 'de', '5', 'mil', 'mortos']","['Fortes', 'chuvas', 'no', 'nordeste', 'da', 'Libia', 'provocadas', 'pela', 'Tempestade', 'Daniel', 'causaram', 'o', 'colapso', 'de', 'duas', 'barragens', 'no', 'domingo', '10', 'inundando', 'cidades', 'na', 'regiao', 'especialmente', 'Derna', 'Ao', 'menos', 'tres', 'pontes', 'for', '5524', 'chars']"
Acao climatica precisa ser antirracista,A nocao de injustica climatica enfatiza os desbalancos dos danos do aquecimento global em que as pessoas que menos contribuiram para o problema sao inversamente as mais impactadas em termos negativo 7808 chars,"['Acao', 'climatica', 'precisa', 'ser', 'antirracista']","['A', 'nocao', 'de', 'injustica', 'climatica', 'enfatiza', 'os', 'desbalancos', 'dos', 'danos', 'do', 'aquecimento', 'global', 'em', 'que', 'as', 'pessoas', 'que', 'menos', 'contribuiram', 'para', 'o', 'problema', 'sao', 'inversamente', 'as', 'mais', 'impactadas', 'em', 'termos', 'negativo', '7808', 'chars']"
Industria do plastico renova modelos de negocio,Um dos materiais mais versateis da era pos industrial e um dos mais nocivos ao meio ambiente Nao ha meio termo quando a questao e o plastico nome originado do grego plastikos ou aquele que pode ser 8393 chars,"['Industria', 'do', 'plastico', 'renova', 'modelos', 'de', 'negocio']","['Um', 'dos', 'materiais', 'mais', 'versateis', 'da', 'era', 'pos', 'industrial', 'e', 'um', 'dos', 'mais', 'nocivos', 'ao', 'meio', 'ambiente', 'Nao', 'ha', 'meio', 'termo', 'quando', 'a', 'questao', 'e', 'o', 'plastico', 'nome', 'originado', 'do', 'grego', 'plastikos', 'ou', 'aquele', 'que', 'pode', 'ser', '8393', 'chars']"
CNI lidera acoes para revitalizar a industria nacional,Neste momento em que a pandemia e as tensoes geopoliticas colocaram em xeque o conceito de economia sem fronteiras e os paises buscam solucoes internas uma politica industrial moderna sustentavel 5936 chars,"['CNI', 'lidera', 'acoes', 'para', 'revitalizar', 'a', 'industria', 'nacional']","['Neste', 'momento', 'em', 'que', 'a', 'pandemia', 'e', 'as', 'tensoes', 'geopoliticas', 'colocaram', 'em', 'xeque', 'o', 'conceito', 'de', 'economia', 'sem', 'fronteiras', 'e', 'os', 'paises', 'buscam', 'solucoes', 'internas', 'uma', 'politica', 'industrial', 'moderna', 'sustentavel', '5936', 'chars']"
Shell suspende silenciosamente o plano radical para reduzir sua pegada de carbono,Seis meses depois de se tornar executivo chefe da Shell Plc Wael Sawan encerrou discretamente o maior plano corporativo do mundo para desenvolver compensacoes de carbono por meio de projetos ambien 16074 chars,"['Shell', 'suspende', 'silenciosamente', 'o', 'plano', 'radical', 'para', 'reduzir', 'sua', 'pegada', 'de', 'carbono']","['Seis', 'meses', 'depois', 'de', 'se', 'tornar', 'executivo', 'chefe', 'da', 'Shell', 'Plc', 'Wael', 'Sawan', 'encerrou', 'discretamente', 'o', 'maior', 'plano', 'corporativo', 'do', 'mundo', 'para', 'desenvolver', 'compensacoes', 'de', 'carbono', 'por', 'meio', 'de', 'projetos', 'ambien', '16074', 'chars']"
